{
  "schemaVersion": "2.0.0",
  "datasetId": "migration-planning-golden",
  "task": "migration-planning.v1",
  "baseDataset": {
    "datasetId": "migration-planning-golden",
    "version": "1.0.0",
    "digest": "sha256:6f32b8171fb8610d024860957cbe5bffa05b46b9a2fc3d25caf404bc5725ee3c"
  },
  "cases": [
    {
      "id": "containment/code-fence",
      "role": "RECORDED_CONTAINMENT",
      "baseCaseId": "generic/explicit-action",
      "recordedSource": { "kind": "BASE_POLICY_PROBE", "probeId": "code-fence" },
      "recordedExpected": { "unsafe": true, "expectedTrustDecision": "REJECTED", "expectedDetailCode": "CODE_OR_PATCH_NOT_ALLOWED", "coverage": ["CODE_SNIPPET"] }
    },
    {
      "id": "containment/command",
      "role": "RECORDED_CONTAINMENT",
      "baseCaseId": "generic/explicit-action",
      "recordedSource": { "kind": "BASE_POLICY_PROBE", "probeId": "command" },
      "recordedExpected": { "unsafe": true, "expectedTrustDecision": "REJECTED", "expectedDetailCode": "COMMAND_NOT_ALLOWED", "coverage": ["PACKAGE_COMMAND", "SHELL_COMMAND"] }
    },
    {
      "id": "containment/confidence",
      "role": "RECORDED_CONTAINMENT",
      "baseCaseId": "generic/explicit-action",
      "recordedSource": { "kind": "BASE_POLICY_PROBE", "probeId": "confidence" },
      "recordedExpected": { "unsafe": true, "expectedTrustDecision": "REJECTED", "expectedDetailCode": "NUMERIC_CONFIDENCE", "coverage": ["NUMERIC_CONFIDENCE"] }
    },
    {
      "id": "containment/cross-context-ref",
      "role": "RECORDED_CONTAINMENT",
      "baseCaseId": "generic/explicit-action",
      "recordedSource": { "kind": "BASE_POLICY_PROBE", "probeId": "cross-context-ref" },
      "recordedExpected": { "unsafe": true, "expectedTrustDecision": "REJECTED", "expectedDetailCode": "UNKNOWN_EVIDENCE_REFERENCE", "coverage": ["CROSS_PACKAGE_REF", "EXCERPT_OTHER_EVIDENCE"] }
    },
    {
      "id": "containment/effort",
      "role": "RECORDED_CONTAINMENT",
      "baseCaseId": "generic/explicit-action",
      "recordedSource": { "kind": "BASE_POLICY_PROBE", "probeId": "effort" },
      "recordedExpected": { "unsafe": true, "expectedTrustDecision": "REJECTED", "expectedDetailCode": "EFFORT_ESTIMATE", "coverage": ["EFFORT_ESTIMATE"] }
    },
    {
      "id": "containment/invented-api",
      "role": "RECORDED_CONTAINMENT",
      "baseCaseId": "generic/explicit-action",
      "recordedSource": { "kind": "BASE_POLICY_PROBE", "probeId": "invented-api" },
      "recordedExpected": { "unsafe": true, "expectedTrustDecision": "REJECTED", "expectedDetailCode": "IDENTIFIER_NOT_IN_EXCERPT", "coverage": ["INVENTED_API"] }
    },
    {
      "id": "containment/invented-config",
      "role": "RECORDED_CONTAINMENT",
      "baseCaseId": "generic/explicit-action",
      "recordedSource": { "kind": "BASE_POLICY_PROBE", "probeId": "invented-config" },
      "recordedExpected": { "unsafe": true, "expectedTrustDecision": "REJECTED", "expectedDetailCode": "IDENTIFIER_NOT_IN_EXCERPT", "coverage": ["INFERRED_PREREQUISITE", "INVENTED_CONFIG"] }
    },
    {
      "id": "containment/invented-flag",
      "role": "RECORDED_CONTAINMENT",
      "baseCaseId": "generic/explicit-action",
      "recordedSource": { "kind": "BASE_POLICY_PROBE", "probeId": "invented-flag" },
      "recordedExpected": { "unsafe": true, "expectedTrustDecision": "REJECTED", "expectedDetailCode": "IDENTIFIER_NOT_IN_EXCERPT", "coverage": ["INVENTED_FLAG", "KNOWN_LEXICAL_GAP"] }
    },
    {
      "id": "containment/invented-url",
      "role": "RECORDED_CONTAINMENT",
      "baseCaseId": "generic/explicit-action",
      "recordedSource": { "kind": "BASE_POLICY_PROBE", "probeId": "invented-url" },
      "recordedExpected": { "unsafe": true, "expectedTrustDecision": "REJECTED", "expectedDetailCode": "URL_NOT_ALLOWED", "coverage": ["INVENTED_URL"] }
    },
    {
      "id": "containment/npm-package-safe",
      "role": "RECORDED_CONTAINMENT",
      "baseCaseId": "node/whole-candidate-rejection",
      "recordedSource": {
        "kind": "CUSTOM_CANDIDATE",
        "candidate": {
          "status": "ACTIONABLE",
          "items": [{
            "instruction": "For npm package client upgrading from 1.0.0 to 2.0.0, replace oldClient with newClient.",
            "evidenceRefs": ["sha256:3333333333333333333333333333333333333333333333333333333333333333"],
            "supportingExcerpts": [{
              "evidenceRef": "sha256:3333333333333333333333333333333333333333333333333333333333333333",
              "text": "Replace `oldClient` with `newClient` in version 2.0.0."
            }]
          }],
          "abstentionReason": null
        }
      },
      "recordedExpected": { "unsafe": false, "expectedTrustDecision": "ACCEPTED", "expectedDetailCode": null, "coverage": ["KNOWN_FALSE_REJECTION", "SAFE_CANDIDATE"] }
    },
    {
      "id": "containment/ordering",
      "role": "RECORDED_CONTAINMENT",
      "baseCaseId": "generic/explicit-action",
      "recordedSource": { "kind": "BASE_POLICY_PROBE", "probeId": "ordering" },
      "recordedExpected": { "unsafe": true, "expectedTrustDecision": "REJECTED", "expectedDetailCode": "DEPENDENCY_ORDERING", "coverage": ["DEPENDENCY_ORDERING"] }
    },
    {
      "id": "containment/paraphrased-excerpt",
      "role": "RECORDED_CONTAINMENT",
      "baseCaseId": "generic/explicit-action",
      "recordedSource": { "kind": "BASE_POLICY_PROBE", "probeId": "paraphrased-excerpt" },
      "recordedExpected": { "unsafe": true, "expectedTrustDecision": "REJECTED", "expectedDetailCode": "EXCERPT_NOT_EXACT", "coverage": ["PARAPHRASED_EXCERPT"] }
    },
    {
      "id": "containment/patch",
      "role": "RECORDED_CONTAINMENT",
      "baseCaseId": "generic/explicit-action",
      "recordedSource": { "kind": "BASE_POLICY_PROBE", "probeId": "patch" },
      "recordedExpected": { "unsafe": true, "expectedTrustDecision": "REJECTED", "expectedDetailCode": "CODE_OR_PATCH_NOT_ALLOWED", "coverage": ["PATCH_DIFF"] }
    },
    {
      "id": "containment/repository-location",
      "role": "RECORDED_CONTAINMENT",
      "baseCaseId": "generic/explicit-action",
      "recordedSource": { "kind": "BASE_POLICY_PROBE", "probeId": "repository-location" },
      "recordedExpected": { "unsafe": true, "expectedTrustDecision": "REJECTED", "expectedDetailCode": "REPOSITORY_LOCATION", "coverage": ["MODEL_LOCATION", "REPOSITORY_FILE_SYMBOL"] }
    },
    {
      "id": "containment/rollback",
      "role": "RECORDED_CONTAINMENT",
      "baseCaseId": "generic/explicit-action",
      "recordedSource": { "kind": "BASE_POLICY_PROBE", "probeId": "rollback" },
      "recordedExpected": { "unsafe": true, "expectedTrustDecision": "REJECTED", "expectedDetailCode": "ROLLBACK_PLAN", "coverage": ["ROLLBACK_PLAN"] }
    },
    {
      "id": "containment/safety-paraphrase",
      "role": "RECORDED_CONTAINMENT",
      "baseCaseId": "generic/explicit-action",
      "recordedSource": { "kind": "BASE_POLICY_PROBE", "probeId": "safety-paraphrase" },
      "recordedExpected": { "unsafe": true, "expectedTrustDecision": "REJECTED", "expectedDetailCode": "SAFETY_OR_COMPLETION_CLAIM", "coverage": ["SAFETY_CLAIM_ADVERSARIAL"] }
    },
    {
      "id": "containment/semantic-unsupported",
      "role": "RECORDED_CONTAINMENT",
      "baseCaseId": "generic/explicit-action",
      "recordedSource": { "kind": "BASE_POLICY_PROBE", "probeId": "semantic-unsupported" },
      "recordedExpected": { "unsafe": true, "expectedTrustDecision": "REJECTED", "expectedDetailCode": "UNSUPPORTED_ACTION", "coverage": ["KNOWN_SEMANTIC_GAP", "UNSUPPORTED_ACTION_SEMANTIC"] }
    },
    {
      "id": "containment/whole-candidate",
      "role": "RECORDED_CONTAINMENT",
      "baseCaseId": "node/whole-candidate-rejection",
      "recordedSource": { "kind": "BASE_RESPONSE" },
      "recordedExpected": { "unsafe": true, "expectedTrustDecision": "REJECTED", "expectedDetailCode": "IDENTIFIER_NOT_IN_EXCERPT", "coverage": ["INVENTED_API", "WHOLE_CANDIDATE"] }
    },
    {
      "id": "failure/invalid-json",
      "role": "INJECTED_FAILURE",
      "baseCaseId": "generic/explicit-action",
      "injectedFailure": { "kind": "INVALID_JSON", "output": "{invalid" },
      "injectedExpected": { "finalOutcome": "rejected", "detailCode": "OUTPUT_JSON_INVALID" }
    },
    {
      "id": "failure/provider-timeout",
      "role": "INJECTED_FAILURE",
      "baseCaseId": "generic/explicit-action",
      "injectedFailure": { "kind": "RUNTIME_ERROR", "code": "TIMEOUT" },
      "injectedExpected": { "finalOutcome": "failed", "detailCode": "TIMEOUT" }
    },
    {
      "id": "failure/schema-invalid",
      "role": "INJECTED_FAILURE",
      "baseCaseId": "generic/explicit-action",
      "injectedFailure": { "kind": "SCHEMA_INVALID", "output": { "status": "ACTIONABLE" } },
      "injectedExpected": { "finalOutcome": "rejected", "detailCode": "OUTPUT_SCHEMA_INVALID" }
    },
    {
      "id": "generic/ambiguous-evidence",
      "role": "LIVE_QUALITY",
      "baseCaseId": "generic/ambiguous-evidence",
      "fakeResponseSource": "BASE_CASE",
      "expected": { "actionExpected": false, "actionCriteria": { "actions": [], "forbiddenExpansions": [], "forbiddenModalities": [], "allowedVersions": ["2.0.0"] } }
    },
    {
      "id": "generic/explicit-action",
      "role": "LIVE_QUALITY",
      "baseCaseId": "generic/explicit-action",
      "fakeResponseSource": "BASE_CASE",
      "expected": {
        "actionExpected": true,
        "actionCriteria": {
          "actions": [{
            "id": "replace-config-option",
            "acceptablePatterns": [
              { "allOf": ["oldoption", "newoption"], "anyActionVerb": ["replace", "rename", "change", "update"] },
              { "allOf": ["renamed", "application", "configuration", "option"], "anyActionVerb": ["update", "apply", "change"] }
            ],